company,region,prefecture_eng,prefecture,city,address,website,num_sake,abv_avg,abv_count,abv_std,acidity_avg,acidity_count,acidity_std,gravity_avg,gravity_count,gravity_std,lat,lon,eng_address,distance_from_coast_deg,elevation,dist_from_coast_km,abv_med,acidity_med,gravity_med,polish_rate_med,grade_med,company_eng
大塚酒造株式会社,Chūbu,Nagano,長野県,小諸市,〒384-0031長野県小諸市大手2-1-24,http://www.asamadake.co.jp/,7,15.142857142857142,7,0.3779644730092271,,0,,0.5714285714285714,7,7.367883976130073,36.3285986,138.4238942,"2-chōme-1-24 Ōte, Komoro, Nagano 384-0031, Japan",0.8681491803425125,678.0,87.51902901460899,15.0,,2.0,39.0,Daiginjō-shu,"Otsuka Sake Brewery Co., Ltd."
大天狗酒造,Tōhoku,Fukushima,福島県,本宮市,〒969-1136福島県本宮市本宮九縄18,http://daitengusyuzo.com/,15,15.133333333333333,12,0.819460280620819,,0,,5.0,5,7.84219357067906,37.5136736,140.4001789,"Kunawa-18 Motomiya, Fukushima 969-1136, Japan",0.6296967204067789,212.0,63.122335458351394,15.45,,3.0,60.0,Daiginjō-shu,Daitengu Sake Brewery
大嶺酒造株式会社,Chūgoku,Yamaguchi,山口県,美祢市,〒754-0603山口県美祢市秋芳町別府2585-2,http://www.ohmine.jp/,6,14.166666666666666,6,0.2581988897471611,,0,,,0,,34.2474156,131.2648003,"2585-2 Shūhōchō Beppu, Mine, Yamaguchi 754-0603, Japan",0.1340109902487842,86.0,13.66755519436176,14.0,,,53.0,Junmai Daiginjō-shu,"Omine Sake Brewery Co., Ltd."
大木代吉本店,Tōhoku,Fukushima,福島県,西白河郡,〒969-0213福島県西白河郡矢吹町本町9,https://ja-jp.facebook.com/ookidaikichi/,9,16.0,9,0.0,,0,,-0.1111111111111111,9,2.9344694769431685,37.2060699,140.3263536,"9 Motomachi, Yabuki, Nishishirakawa District, Fukushima 969-0213, Japan",0.5752952003096832,290.0,57.76675420932741,16.0,,1.0,60.0,Junmai Daiginjō-shu,Okiyoyoshi main store
大沼酒造店,Tōhoku,Miyagi,宮城県,柴田郡,〒989-1305宮城県柴田郡村田町56-1,https://miyagisake.jp/kuramoto/onuma/,3,16.333333333333332,3,0.5773502691896255,1.7666666666666666,3,0.2309401076758502,1.0,3,1.7320508075688772,38.1192003,140.7206536,"989-1305, Japan",0.2166931993559803,41.0,21.66987045289164,16.0,1.9,0.0,50.0,Junmai Daiginjō-shu,Onuma Sake Brewery
大澤本家酒造株式会社,Kansai,Hyōgo,兵庫県,西宮市,〒662-0922兵庫県西宮市東町1丁目13番28号,http://ohsawasyuzo.com/,13,18.83333333333333,12,3.0698929011029725,,0,,,0,,34.7251173,135.342065,"1-chōme-13-28 Higashimachi, Nishinomiya, Hyogo 662-0922, Japan",0.0166268382447725,3.0,1.6921574059177475,18.0,,,50.0,Junmai Daiginjō-shu,"Osawa Honke Sake Brewery Co., Ltd."
大石酒造株式会社,Kansai,Kyoto,京都府,亀岡市,〒621-0033京都府亀岡市ひえ田野町佐伯垣内亦13,https://www.okinazuru.co.jp/,15,16.23846153846154,13,1.5212595995525446,,0,,2.5,12,3.68041499636312,35.0175582,135.5349864,"Japan, 〒621-0033 Kyoto, Kameoka, Hiedanochō Saeki, Kakiuchimata, 薭田野町佐伯垣内亦１",0.3476064737948832,108.0,35.30589026528383,15.6,,4.0,70.0,Junmai Daiginjō-shu,"Oishi Sake Brewery Co., Ltd."
大美酒造有限会社,Chūgoku,Okayama,岡山県,真庭市,〒717-0505岡山県真庭市蒜山上長田1989,https://i-maniwa.com/area/s-omi/,7,17.5,7,2.309401076758504,,0,,,0,,35.2907748,133.7211538,"1989 Hiruzenkaminagata, Maniwa, Okayama 717-0505, Japan",0.21236695466766,420.0,21.545836706511647,16.5,,,65.0,Junmai Ginjō-shu,"Daibi Brewery Co., Ltd."
大谷忠吉本店,Tōhoku,Fukushima,福島県,白河市,〒961-0905福島県白河市本町54,http://www.hakuyou.co.jp/,6,15.5,6,1.0488088481701516,,0,,1.4166666666666667,6,3.638910093237626,37.1265738,140.2170962,"54 Motomachi, Shirakawa, Fukushima 961-0905, Japan",0.634392000395037,357.0,63.72003823784698,15.5,,2.5,55.0,Junmai Ginjō-shu,Otani Tadayoshi Main Store
大谷酒造株式会社,Chūgoku,Tottori,鳥取県,東伯郡,〒689-2352鳥取県東伯郡琴浦町浦安368,https://takaisami.co.jp/,27,16.3,5,1.0954451150103324,,0,,9.0,2,1.4142135623730951,35.4931966,133.6917477,"368 Urayasu, Kotoura, Tōhaku District, Tottori 689-2352, Japan",0.0167819036435561,28.0,1.7014962677202392,15.5,,9.0,50.0,Junmai Daiginjō-shu,"Otani Sake Brewery Co., Ltd."
大賀酒造株式会社,Kyūshū,Fukuoka,福岡県,筑紫野市,〒818-0072福岡県筑紫野市二日市中央4丁目9番1号,http://www.ogashuzo.com/,13,15.291666666666666,12,2.508696993672334,,0,,,0,,33.4994141,130.518318,"4-chōme-9-1 Futsukaichichūō, Chikushino, Fukuoka 818-0072, Japan",0.1654264286511712,34.0,16.931180360544275,15.0,,,50.0,Junmai Daiginjō-shu,"Oga Sake Brewery Co., Ltd."
大里酒造株式会社,Kyūshū,Fukuoka,福岡県,嘉麻市,〒820-0304福岡県嘉麻市大隈551,http://www.kurodabusi.com/,16,17.125,16,6.216912416947821,1.3866666666666667,15,0.1922300209446509,1.5,16,4.442221666388715,33.5373443,130.7565783,"551 Ōkuma, Kama, Fukuoka 821-0004, Japan",0.3241105895293611,66.0,33.157466601720095,15.0,1.4,3.0,55.0,Daiginjō-shu,"Osato Sake Brewery Co., Ltd."
大門酒造株式会社,Kansai,Osaka,大阪府,交野市,〒576-0031大阪府交野市森南3丁目12番1号,https://www.daimonbrewery.com/index.php,10,16.8,10,1.5491933384829664,,0,,,0,,34.77761,135.6892792,"3-chōme-12-1 Moriminami, Katano, Osaka 576-0031, Japan",0.289277502425175,40.0,29.4191120355356,16.0,,,52.5,Junmai Daiginjō-shu,"Daimon Sake Brewery Co., Ltd."
大関株式会社,Kansai,Hyōgo,兵庫県,西宮市,〒663-8227兵庫県西宮市今津出在家町4番9号,https://www.ozeki.co.jp/,56,13.785714285714286,56,1.7025572820616928,1.407142857142857,56,0.3079888680734141,-1.0803571428571428,56,13.847801527421495,34.7256761,135.3514056,"4-9 Imazudezaikechō, Nishinomiya, Hyogo 663-8227, Japan",0.0199367073175609,7.0,2.0289944424031803,14.0,1.3,1.5,70.0,Junmai Daiginjō-shu,"Ozeki Co., Ltd."
天吹酒造合資会社,Kyūshū,Saga,佐賀県,三養基郡,〒849-0113佐賀県三養基郡みやき町東尾2894,http://www.amabuki.co.jp/,29,16.0,21,0.632455532033675,1.35,2,0.2121320343559643,7.4,5,5.9833101206606365,33.3266487,130.4574018,"2894 Higashio, Miyaki, Miyaki District, Saga 849-0113, Japan",0.2080845326545078,3.0,21.31308927589844,16.0,1.35,10.0,50.0,Junmai Daiginjō-shu,Amabuki Sake Brewery Limited Partnership Company
天寿酒造株式会社,Tōhoku,Akita,秋田県,由利本荘市,〒015-0411秋田県由利本荘市矢島町城内字八森下117,http://www.tenju.co.jp/,6,14.833333333333334,6,0.4082482904638631,1.46,5,0.1140175425099138,2.24,5,1.1631852818876278,39.2301628,140.1373273,"Hachimorishita-117 Yashimamachi Jōnai, Yurihonjo, Akita 015-0411, Japan",0.1720756939521962,60.0,17.108473982810548,15.0,1.5,2.0,60.0,Junmai Daiginjō-shu,"Tenju Sake Brewery Co., Ltd."
天山酒造株式会社,Kyūshū,Saga,佐賀県,小城市,〒845-0003佐賀県小城市小城町大字岩蔵1520番地,http://www.tenzan.co.jp/main/,67,15.93731343283582,67,1.383762527894399,1.6071428571428572,56,0.3371577148388045,2.268181818181818,55,2.5701340870836344,33.3113783,130.1931666,"1520 Ogimachi Iwakura, Ogi, Saga 845-0003, Japan",0.1322521205987756,65.0,13.548638767094808,16.0,1.5,2.0,60.0,Junmai Daiginjō-shu,"Tenzan Sake Brewery Co., Ltd."
天界酒造株式会社,Chūgoku,Shimane,島根県,安来市,〒692-0011島根県安来市,http://www2.crosstalk.or.jp/tenkai/,13,,0,,,0,,,0,,35.4317631,133.2545686,"692-0011, Japan",0.061677666798255,2.0,6.254834731096898,,,,55.0,Junmai Daiginjō-shu,"Tenkai Sake Brewery Co., Ltd."
天長島村酒造株式会社,Kansai,Wakayama,和歌山県,和歌山市,〒640-8033和歌山県和歌山市本町7丁目4番地,http://www.tencho-shimamura.jp/,15,,0,,,0,,,0,,34.2409306,135.1742721,"7-chōme-4 Honmachi, Wakayama, 640-8033, Japan",0.0410400941703972,5.0,4.186405682024571,,,,,Daiginjō-shu,"Tenagashimamura Sake Brewery Co., Ltd."
天領誉酒造株式会社,Chūbu,Nagano,長野県,中野市,〒383-0041長野県中野市岩船190,http://www.tenryohomare.com/,8,14.9125,8,0.5693040864574427,,0,,1.5714285714285714,7,4.540820148282424,36.7454593,138.35661,"190 Iwafune, Nakano, Nagano 383-0041, Japan",0.4493971677010869,353.0,45.24234618304998,14.9,,2.0,55.0,Daiginjō-shu,"Tenryo Homare Sake Brewery Co., Ltd."
天鷹酒造株式会社,Kantō,Tochigi,栃木県,大田原市,〒324-0411栃木県大田原市蛭畑2166,http://www.tentaka.co.jp/,24,15.625,24,0.7696696072652387,,0,,,0,,36.8035177,140.0977176,"2166 Hiruhata, Otawara, Tochigi 324-0411, Japan",0.6020678772088477,142.0,60.577410493381976,15.5,,,58.0,Junmai Daiginjō-shu,"Tentaka Sake Brewery Co., Ltd."
太平桜酒造合資会社,Tōhoku,Fukushima,福島県,いわき市,〒972-8317福島県いわき市内郷高坂町中平14,http://www.sake-iwaki.com/,10,16.3,10,1.4944341180973262,,0,,2.9,10,2.4244128727957577,37.0465792,140.8608754,"Nakadaira-14 Uchigōtakasakamachi, Iwaki, Fukushima 973-8408, Japan",0.1185615447813131,15.0,11.924760378787177,16.0,,3.0,65.0,Junmai Daiginjō-shu,Taiheizakura Sake Brewing Limited Partnership Company
太田商店,Kansai,Nara,奈良県,生駒郡,〒636-0152奈良県生駒郡斑鳩町龍田3丁目3-5,http://www.otashouten.com/,8,19.5,1,,,0,,,0,,34.6076247,135.7195701,"3-chōme-3-5 Tatsuta, Ikaruga, Ikoma District, Nara 636-0152, Japan",0.3037950749845485,49.0,30.920417021450213,19.5,,,,Honjōzō-shu,Ota Shoten
太田酒造株式会社,Kansai,Shiga,滋賀県,草津市,〒525-0034滋賀県草津市草津三丁目10-37,http://www.ohta-shuzou.co.jp/,36,,0,,1.6310344827586205,29,0.3645970851265251,3.9466666666666654,30,2.240186773822485,35.0150564,135.9583862,"3-chōme-10-37 Kusatsu, Shiga 525-0034, Japan",0.5300965004682567,98.0,53.82463103578596,,1.7,4.0,60.0,Junmai Daiginjō-shu,"Ota Sake Brewery Co., Ltd."
太陽酒造株式会社,Kansai,Hyōgo,兵庫県,明石市,〒674-0064兵庫県明石市大久保町江井島789,http://taiyoshuzo.sunnyday.jp/,7,18.928571428571427,7,0.8380817098475264,,0,,,0,,34.6773428,134.9168514,"Eigashima-789 Ōkubochō, Akashi, Hyogo 674-0064, Japan",0.0027851553573496,15.0,0.2835254275357332,19.5,,,60.0,Junmai Daiginjō-shu,"Taiyo Sake Brewery Co., Ltd."
奈良豊澤酒造株式会社,Kansai,Nara,奈良県,奈良市,〒630-8444奈良県奈良市今市町405番地,http://nara-toyosawa.jp/,13,15.26923076923077,13,2.9198700357449177,1.553846153846154,13,0.3125576869832314,2.3076923076923075,13,6.911760694456651,34.6460063,135.8207438,"405 Imaichichō, Nara, 630-8444, Japan",0.4065944250337717,58.0,41.3682773308901,15.5,1.5,2.0,70.0,Daiginjō-shu,"Nara Toyosawa Sake Brewery Co., Ltd."
奥の松酒造株式会社,Tōhoku,Fukushima,福島県,二本松市,〒964-0866福島県二本松市長命69,http://www.okunomatsu.co.jp/,48,15.145833333333334,48,1.2375264163668072,1.4479166666666667,48,0.2649685515930773,-0.7291666666666666,48,5.87091490689242,37.5611878,140.4058692,"69 Chōmei, Nihommatsu, Fukushima 964-0866, Japan",0.6133475404932394,213.0,61.47012355456226,15.0,1.4,0.0,60.0,Junmai Daiginjō-shu,"Okunomatsu Sake Brewery Co., Ltd."
奥出雲酒造株式会社,Chūgoku,Shimane,島根県,仁多郡,〒699-1701島根県仁多郡奥出雲町亀嵩1380番地1,http://www.okuizumosyuzou.com/,7,14.428571428571429,7,1.9880595947760096,,0,,,0,,35.227763,133.0871961,"1380-1 Kamedake, Okuizumo, Nita District, Shimane 699-1701, Japan",0.3121721940591386,328.0,31.675978087327803,15.0,,,60.0,Junmai Daiginjō-shu,"Oku-Izumo Sake Brewery Co., Ltd."
奥飛騨酒蔵株式会社,Chūbu,Gifu,岐阜県,下呂市,〒509-1622岐阜県下呂市金山町金山1984番地,https://www.okuhida.co.jp/,41,15.235526315789476,38,1.9371512901449857,1.5666666666666669,36,0.1414213562373095,-1.4736842105263157,38,13.706847454496058,35.6625146,137.1575178,"1984 Kanayamachō Kanayama, Gero, Gifu 509-1622, Japan",0.6344788969656945,234.0,64.20466887262363,15.0,1.5,1.0,55.0,Junmai Daiginjō-shu,"Okuhida Sake Brewery Co., Ltd."
宇都宮酒造株式会社,Kantō,Tochigi,栃木県,宇都宮市,〒321-0902栃木県宇都宮市柳田町248,http://www.shikisakura.co.jp/,29,16.324137931034482,29,1.2460380561758229,1.4689655172413794,29,0.2037215331136774,3.034482758620689,29,1.6142835345902715,36.5598204,139.9562668,"248 Yanagitamachi, Utsunomiya, Tochigi 321-0902, Japan",0.6658515515108379,111.0,67.07078336198218,16.2,1.4,3.0,60.0,Junmai Daiginjō-shu,"Utsunomiya Sake Brewery Co., Ltd."
安井酒造場,Kansai,Shiga,滋賀県,甲賀市,〒528-0234滋賀県甲賀市土山町徳原225番地,https://www.hatsusakura.jp/,18,,0,,,0,,,0,,34.9482505,136.2303489,"225 Tsuchiyamachō Tokuhara, Koka, Shiga 528-0234, Japan",0.3551086812137839,207.0,36.07970577826256,,,,60.0,Junmai Daiginjō-shu,Yasui Sake Brewery
宗政酒造株式会社,Kyūshū,Saga,佐賀県,西松浦郡,〒844-0014佐賀県西松浦郡有田町戸矢乙340番地28,http://www.nonnoko.com/,6,15.75,6,1.6658331248957683,1.8083333333333336,6,0.944678075677988,-4.708333333333333,6,8.689672989627784,33.1644683,129.9084034,"Otsu-340-28 Toya, Arita, Nishimatsuura District, Saga 844-0014, Japan",0.1052178478625876,145.0,10.787050198975752,15.0,1.55,-2.625,60.0,Daiginjō-shu,"Munemasa Sake Brewery Co., Ltd."
宝酒造株式会社,Kansai,Kyoto,京都府,京都市,〒600-8688京都府京都市下京区四条通烏丸東入長刀鉾町20(四条烏丸ＦＴスクエア),https://www.takarashuzo.co.jp/,63,14.071428571428571,63,2.7604013599842263,1.4651162790697674,43,0.7180939456148353,-2.395348837209302,43,18.52686535160138,35.0033289,135.7603627,"20 Naginatabokochō, Shimogyo Ward, Kyoto, 600-8008, Japan",0.4664549312745005,52.0,47.37064134706352,15.0,1.3,2.0,50.0,Junmai Daiginjō-shu,"Takara Shuzo Co., Ltd."
室原合名会社,Kyūshū,Kumamoto,熊本県,阿蘇郡,〒869-2401阿蘇郡南小国町赤馬場1862,,2,,0,,,0,,,0,,33.0958673,131.0694248,"1862 Akababa, Minamioguni, Aso District, Kumamoto 869-2401, Japan",0.4753528602615935,453.0,48.719349445879566,,,,,,Murohara LLC
室町酒造株式会社,Chūgoku,Okayama,岡山県,赤磐市,〒709-0835岡山県赤磐市西中1342-1,http://sakuramuromachi.co.jp/,44,15.91590909090909,44,1.405792531885887,,0,,2.627906976744186,43,4.10587996376598,34.7655768,134.0057416,"1342-1 Nishinaka, Akaiwa, Okayama 709-0835, Japan",0.1568113725920747,29.0,15.952093185860544,15.5,,3.0,60.0,Junmai Daiginjō-shu,"Muromachi Sake Brewery Co., Ltd."
宮下酒造株式会社,Chūgoku,Okayama,岡山県,岡山市,〒703-8258岡山県岡山市中区西川原184,https://www.msb.co.jp/,66,15.863636363636363,66,1.232712626519425,1.88,5,1.0756393447619883,-0.7551020408163265,49,12.25175261653902,34.6790035,133.9396545,"184 Nishigawara, Naka Ward, Okayama, 703-8258, Japan",0.0831108758144061,7.0,8.459346308568508,15.5,1.4,3.0,60.0,Junmai Daiginjō-shu,"Miyashita Sake Brewery Co., Ltd."
宮泉銘醸株式会社,Tōhoku,Fukushima,福島県,会津若松市,〒965-0872福島県会津若松市東栄町八番七号,http://www.miyaizumi.co.jp/,24,,0,,,0,,,0,,37.4921172,139.9310689,"8-7 Higashisakaemachi, Aizuwakamatsu, Fukushima 965-0872, Japan",0.8259859976057097,222.0,82.77807306560884,,,,50.0,Junmai Daiginjō-shu,"Miyaizumi Meijo Co., Ltd."
富久千代酒造有限会社,Kyūshū,Saga,佐賀県,鹿島市,〒849-1322佐賀県鹿島市浜町1244-1,http://nabeshima.biz/,28,15.666666666666666,9,0.8291561975888498,,0,,,0,,33.0937381,130.1150257,"1244-1 Hamamachi, Kashima, Saga 849-1322, Japan",0.0188173335551941,6.0,1.930092085400623,15.5,,,50.0,Junmai Daiginjō-shu,"Fukuchiyo Brewing Co., Ltd."
富久錦株式会社,Kansai,Hyōgo,兵庫県,加西市,〒675-2223兵庫県加西市三口町1048,http://www.fukunishiki.co.jp/,9,15.61111111111111,9,0.2204792759220491,,0,,,0,,34.8696415,134.8373179,"1048 Mikuchichō, Kasai, Hyogo 675-2223, Japan",0.1353039815444271,51.0,13.757696999304995,15.5,,,70.0,Junmai Daiginjō-shu,"Fukunishiki Co., Ltd."
富士正酒造合資会社,Chūbu,Shizuoka,静岡県,富士宮市,〒418-0101静岡県富士宮市根原450-1,https://www.fujimasa-sake.com/,22,16.181818181818183,22,1.3675269175156557,,0,,1.5454545454545454,22,3.996751928006787,35.4115274,138.5911741,"450-1 Nebara, Fujinomiya, Shizuoka 418-0101, Japan",0.2920283489522259,892.0,29.60607270823771,16.0,,2.0,60.0,Junmai Daiginjō-shu,Fujimasa Sake Brewing Limited Partnership Company
富士錦酒造株式会社,Chūbu,Shizuoka,静岡県,富士宮市,〒419-0301静岡県富士宮市上柚野532,http://www.fujinishiki.com/page/item/index.html,26,15.495833333333332,24,1.4402533492913423,,0,,,0,,35.2691117,138.5596092,"532 Kamiyuno, Fujinomiya, Shizuoka 419-0301, Japan",0.1571197198059384,229.0,15.943940450499577,15.0,,,52.5,Junmai Daiginjō-shu,"Fujinishiki Sake Brewery Co., Ltd."
寒北斗酒造株式会社,Kyūshū,Fukuoka,福岡県,嘉麻市,〒820-0302福岡県嘉麻市大隈町1036-1,http://kanhokuto.com/,25,15.4,25,1.0801234497346426,1.648,25,0.132664991614216,3.72,25,2.000416623272929,33.5474286,130.7440898,"1036-1 Ōkumamachi, Kama, Fukuoka 820-0302, Japan",0.3287740265787867,52.0,33.63267226345789,15.0,1.7,4.0,55.0,Junmai Daiginjō-shu,"Kanhokuto Sake Brewery Co., Ltd."
寿虎屋酒造株式会社,Tōhoku,Yamagata,山形県,山形市,〒990-2235山形県山形市中里北田93-1,http://kotobukitoraya.co.jp/,36,,0,,,0,,15.0,1,,38.3008977,140.3877974,"Nakazato, Yamagata, 990-2235, Japan",0.5902459475714866,157.0,58.928639156482085,,,15.0,55.0,Junmai Daiginjō-shu,"Jutoraya Sake Brewery Co., Ltd."
寿酒造株式会社,Kansai,Osaka,大阪府,高槻市,〒569-0814大阪府高槻市富田町三丁目26-12,http://www.kuninocho.jp/,16,15.666666666666666,15,0.617213399848368,1.2333333333333334,3,0.0577350269189625,1.8666666666666667,15,3.130875429074264,34.83290420000001,135.5922966,"3-chōme-26-12 Tondachō, Takatsuki, Osaka 569-0814, Japan",0.2280380049330023,16.0,23.18732752989473,16.0,1.2,3.0,60.0,Daiginjō-shu,"Kotobuki Sake Brewery Co., Ltd."
小原酒造株式会社,Tōhoku,Fukushima,福島県,喜多方市,〒966-0074福島県喜多方市南町2846,http://www.oharashuzo.co.jp/,32,15.0,15,3.220913801126275,2.457142857142857,14,2.355587232261036,-6.192857142857143,14,19.283849930236133,37.653537,139.8798465,"2846 Minamimachi, Kitakata, Fukushima 966-0074, Japan",0.6718819953937973,213.0,67.29682307599433,15.7,1.5,1.4,60.0,Junmai Daiginjō-shu,"Ohara Sake Brewery Co., Ltd."
小坂酒造株式会社,Chūgoku,Okayama,岡山県,赤磐市,〒701-2225岡山県赤磐市山口265-1,http://www.turunoike.co.jp/,10,16.3,10,1.6865480854231356,1.0,1,,-17.0,1,,34.7946602,133.9850653,"265-1 Yamaguchi, Akaiwa, Okayama 701-2225, Japan",0.1861840939525962,58.0,18.9364624528915,15.5,1.0,-17.0,60.0,Junmai Daiginjō-shu,"Kosaka Sake Brewery Co., Ltd."
小島酒造店,Kantō,Tochigi,栃木県,塩谷郡,〒329-2336栃木県塩谷郡塩谷町風見1185,http://murakamisaketen.co.jp/kojima.html,6,,0,,,0,,,0,,36.7348252,139.8669265,"1185 Kazami, Shioya, Shioya District, Tochigi 329-2336, Japan",0.7904382960052172,220.0,79.53110492488538,,,,,Daiginjō-shu,Kojima Sake Brewery
小弓鶴酒造株式会社,Chūbu,Aichi,愛知県,犬山市,〒484-0894愛知県犬山市大字羽黒字成海郷70,http://www.koyumitsuru.jp/,3,16.666666666666668,3,2.466441431158124,,0,,,0,,35.3461003,136.9456604,"Narumigō-70 Haguro, Inuyama, Aichi 484-0894, Japan",0.2632717576996606,45.0,26.700718117169554,15.5,,,70.0,Honjōzō-shu,"Koyutsuru Sake Brewery Co., Ltd."
小手川酒造株式会社,Kyūshū,Ōita,大分県,臼杵市,〒875-0041大分県臼杵市大字臼杵538,https://www.fundokin.co.jp/kotegawa/,3,16.333333333333332,3,2.309401076758503,,0,,,0,,33.1205678,131.7971388,"538 Usuki, Oita 875-0041, Japan",0.0143097259773742,7.0,1.4675733791908108,15.0,,,,Honjōzō-shu,"Kotegawa Sake Brewery Co., Ltd."
小松酒造株式会社,Kyūshū,Saga,佐賀県,唐津市,〒849-3211佐賀県唐津市相知町千束1489,http://www.manrei.jp/,5,15.0,1,,,0,,,0,,33.3506519,130.0228074,"1489 Ōchichō Senzoku, Karatsu, Saga 849-3211, Japan",0.0953209017086685,38.0,9.76399184441948,15.0,,,50.0,Daiginjō-shu,"Komatsu Sake Brewery Co., Ltd."
小林酒造株式会社,Hokkaidō,Hokkaido,北海道,夕張郡,〒069-1521北海道夕張郡栗山町錦3-109,http://www.kitanonishiki.com/,10,15.5,7,0.4999999999999998,1.5833333333333333,6,0.278687399547713,2.0,6,4.289522117905444,43.0615611,141.7697439,"3-chōme-109 Nishiki, Kuriyama, Yubari District, Hokkaido 069-1521, Japan",0.4305450760565321,26.0,41.888757432655794,15.5,1.65,1.0,50.0,Junmai Daiginjō-shu,"Kobayashi Sake Brewery Co., Ltd."
小柳酒造株式会社,Kyūshū,Saga,佐賀県,小城市,〒845-0001佐賀県小城市小城町903番地,,7,16.5,6,1.5165750888103104,,0,,0.6666666666666666,6,2.5232254490367416,33.2988954,130.2025968,"903 Ogimachi, Ogi, Saga 845-0001, Japan",0.1172661322716629,33.0,12.014399997921402,16.5,,0.5,59.0,Daiginjō-shu,"Koyanagi Sake Brewery Co., Ltd."
小玉醸造株式会社,Tōhoku,Akita,秋田県,潟上市,〒018-1504秋田県潟上市飯田川飯塚字飯塚34-1,http://www.kodamajozo.co.jp/,28,15.7,20,0.9233805168766388,1.5,1,,-0.1,1,,39.8968875,140.0768945,"Iizuka-34-1 Iitagawaiizuka, Katagami, Akita 018-1504, Japan",0.0847272711859554,5.0,8.395170590155693,15.0,1.5,-0.1,55.0,Junmai Daiginjō-shu,"Kodama Brewing Co., Ltd."
小町酒造株式会社,Chūbu,Gifu,岐阜県,各務原市,〒504-0851岐阜県各務原市蘇原伊吹町2-15,https://www.nagaragawa.co.jp/,24,15.625,24,1.261899878892072,1.5272727272727271,22,0.2074374677590889,6.181818181818182,22,5.662208585049306,35.4221932,136.8616601,"2-chōme-15 Soharaibukichō, Kakamigahara, Gifu 504-0851, Japan",0.3289549060576792,35.0,33.345783970137255,15.5,1.5,5.0,60.0,Junmai Daiginjō-shu,"Komachi Sake Brewery Co., Ltd."
小西酒造株式会社,Kansai,Hyōgo,兵庫県,伊丹市,〒664-0845兵庫県伊丹市東有岡2-13,http://www.konishi.co.jp/index.php,34,15.647058823529411,34,1.559571676652521,1.5888888888888888,18,0.5422056142318845,-0.5,34,9.33955420388322,34.7768164,135.4229749,"2-chōme-13 Higashiarioka, Itami, Hyogo 664-0845, Japan",0.0853252289045773,7.0,8.680553596675384,15.5,1.4,2.0,50.0,Junmai Daiginjō-shu,"Konishi Sake Brewery Co., Ltd."
小野酒造株式会社,Chūgoku,Hiroshima,広島県,山県郡,〒731-1502広島県山県郡北広島町蔵迫47,http://oigame.co.jp/,17,16.470588235294116,17,1.494475119348911,1.423529411764706,17,0.3031695312954161,2.4705882352941178,17,7.500980328087319,34.7063222,132.5040306,"47 Kurazako, Kitahiroshima, Yamagata District, Hiroshima 731-1502, Japan",0.3439032408352346,300.0,34.983356041364665,16.5,1.4,3.0,60.0,Daiginjō-shu,"Ono Sake Brewery Co., Ltd."
尾崎酒造株式会社,Tōhoku,Aomori,青森県,西津軽郡,〒038-2744青森県西津軽郡鯵ヶ沢町大字漁師町30,http://www.ozakishuzo.com/,30,15.725,20,1.0691240881158146,1.4,2,0.2828427124746192,1.973684210526316,19,1.2301048307916045,40.7829307,140.1979599,"30 Ryōshimachi, Ajigasawa, Nishitsugaru District, Aomori 038-2744, Japan",0.0030100866114112,14.0,0.2968637720734148,15.5,1.4,2.0,60.0,Junmai Daiginjō-shu,"Ozaki Sake Brewery Co., Ltd."
山の壽酒造株式会社,Kyūshū,Fukuoka,福岡県,久留米市,〒830-1125福岡県久留米市北野町乙丸1番地,http://yamanokotobuki.com/about/,8,14.857142857142858,7,1.345185418269098,,0,,,0,,33.3516399,130.608621,"1 Kitanomachi Otomaru, Kurume, Fukuoka 830-1125, Japan",0.3226813547844889,11.0,33.04043205243279,15.0,,,60.0,Junmai Daiginjō-shu,"Yamaju Sake Brewing Co., Ltd."
山内酒造株式会社,Chūbu,Gifu,岐阜県,中津川市,〒509-9231岐阜県中津川市上野小野沢134番地1,https://yamauchisyuzou.com/,7,16.142857142857142,7,1.2136132591798527,,0,,2.571428571428572,7,2.819996622760558,35.5874852,137.4931828,"Ueno, Nakatsugawa, Gifu 509-9231, Japan",0.7856791128961245,605.0,79.51349173229976,15.2,,3.0,55.0,Junmai Ginjō-shu,"Yamauchi Sake Brewery Co., Ltd."
山口合名会社酒造,Tōhoku,Fukushima,福島県,会津若松市,〒965-0031福島県会津若松市相生町7-17,http://sakenosakuraya.com/kaisyuichi.html,7,15.571428571428571,7,0.5345224838248487,1.4,1,,0.5142857142857143,7,2.0456690604205523,37.501508,139.9361852,"7-17 Aioimachi, Aizuwakamatsu, Fukushima 965-0031, Japan",0.8222542211408369,225.0,82.40062823354558,16.0,1.4,2.0,50.0,Junmai Ginjō-shu,Yamaguchi Partnership Company Sake Brewery
山名酒造株式会社,Kansai,Hyōgo,兵庫県,丹波市,〒669-4322兵庫県丹波市市島町上田211,http://www.okutamba.co.jp/,15,15.333333333333334,15,0.8164965809277263,,0,,3.2666666666666666,15,1.5796322658258457,35.2083101,135.1341464,"211 Ichijimachō Kamida, Tamba, Hyogo 669-4322, Japan",0.3018868659293262,62.0,30.63582821051601,15.0,,3.0,60.0,Junmai Daiginjō-shu,"Yamana Sake Brewery Co., Ltd."
山城屋酒造株式会社,Chūgoku,Yamaguchi,山口県,山口市,〒753-0047山口県山口市道場門前2-1-7,https://sugihime.jp/,5,15.5,5,0.7071067811865476,,0,,1.9,5,1.08397416943394,34.1740303,131.4759823,"2-chōme-1-7 Dōjōmonzen, Yamaguchi, 753-0047, Japan",0.14214986558948,29.0,14.502557818818945,15.5,,1.5,60.0,Daiginjō-shu,"Yamashiroya Sake Brewery Co., Ltd."
山岡酒造株式会社,Chūgoku,Hiroshima,広島県,三次市,〒729-4102広島県三次市甲奴町西野489-1,http://wp1.fuchu.jp/~zuikan/,20,12.0,1,,,0,,,0,,34.69865619999999,133.0757685,"489-1 Kōnuchō Nishino, Miyoshi, Hiroshima 729-4102, Japan",0.309354528027032,343.0,31.47197124458426,12.0,,,55.0,Junmai Daiginjō-shu,"Yamaoka Sake Brewery Co., Ltd."
山崎合資会社,Chūbu,Aichi,愛知県,西尾市,〒444-0703愛知県西尾市西幡豆町柿田57,https://www.sonnoh.co.jp/,57,16.885964912280702,57,1.3330200133117749,1.612280701754386,57,0.2712867324954726,3.008771929824561,57,3.886206408649259,34.79295159999999,137.1227718,"Kakida-57 Nishihazuchō, Nishio, Aichi 444-0703, Japan",0.0046405710757188,15.0,0.4721366367682243,17.5,1.7,2.0,60.0,Junmai Daiginjō-shu,Yamazaki LLC
