company,region,prefecture_eng,prefecture,city,address,website,num_sake,abv_avg,abv_count,abv_std,acidity_avg,acidity_count,acidity_std,gravity_avg,gravity_count,gravity_std,lat,lon,eng_address,distance_from_coast_deg,elevation,dist_from_coast_km,abv_med,acidity_med,gravity_med,polish_rate_med,grade_med,company_eng
浪花酒造有限会社,Kansai,Osaka,大阪府,阪南市,〒599-0201大阪府阪南市尾崎町3-13-6,http://www.naniwamasamune.com/,13,16.333333333333332,9,0.3535533905932739,1.2333333333333334,3,0.0577350269189626,3.6666666666666665,9,0.8660254037844386,34.3640806,135.2412359,"3-chōme-13-6 Ozakichō, Hannan, Osaka 599-0201, Japan",0.0012687799432021,5.0,0.1293571454460183,16.5,1.2,3.0,50.0,Junmai Daiginjō-shu,"Naniwa Sake Brewing Co., Ltd."
清水屋酒造有限会社,Kantō,Gunma,群馬県,館林市,〒374-0068群馬県館林市台宿町3-10,http://www.sakaemasu.com/,4,16.0,4,0.0,2.05,4,0.0912870929175276,-2.375,4,4.75,36.2531788,139.5356564,"3-10 Daijukuchō, Tatebayashi, Gunma 374-0068, Japan",0.6421258594317402,28.0,64.78460350503666,16.0,2.05,-4.0,45.0,Junmai Daiginjō-shu,"Shimizuya Sake Brewery Co., Ltd."
清水清三郎商店株式会社,Kansai,Mie,三重県,鈴鹿市,〒510-0225三重県鈴鹿市若松東3-9-33,http://seizaburo.jp/,19,15.6875,16,0.8732124598286508,,0,,,0,,34.8683208,136.6226872,"3-chōme-9-33 Wakamatsuhigashi, Suzuka, Mie 510-0225, Japan",0.0025961190971696,3.0,0.2640355455378944,15.0,,,50.0,Junmai Daiginjō-shu,"Shimizu Seizaburo Shoten Co., Ltd."
清洲桜醸造株式会社,Chūbu,Aichi,愛知県,清須市,〒452-0942愛知県清須市清洲1692番地,https://www.onikoroshi.co.jp/,17,15.382352941176473,17,1.3408184506662555,1.38125,16,0.1558578412100806,1.0625,16,2.0155644370746373,35.2133036,136.8410273,"Kiyosu, Aichi 452-0942, Japan",0.1237993850078678,5.0,12.566909092679628,15.0,1.4,1.0,60.0,Junmai Daiginjō-shu,"Kiyosu Sakura Brewing Co., Ltd."
清鶴酒造株式会社,Kansai,Osaka,大阪府,高槻市,〒569-0814大阪府高槻市富田町六丁目五番三号,http://www.kiyotsuru.jp/,18,16.0,18,1.371988681140071,1.3555555555555554,18,0.1542428269748795,1.1333333333333333,18,2.1941097618530443,34.8292824,135.5956089,"6-chōme-5-3 Tondachō, Takatsuki, Osaka 569-0814, Japan",0.2284591484432737,14.0,23.230545280741104,15.0,1.3,0.0,70.0,Junmai Daiginjō-shu,"Seitsuru Sake Brewery Co., Ltd."
渡辺酒造醸,Chūbu,Gifu,岐阜県,大垣市,〒503-0015岐阜県大垣市林町8-1126,https://minonishiki.com/,11,,0,,,0,,,0,,35.3718373,136.6209537,"8-chōme-1126 Hayashimachi, Ogaki, Gifu 503-0015, Japan",0.3600031790415834,8.0,36.500241091526696,,,,,Junmai Daiginjō-shu,Watanabe Sake Brewery
溝上酒造株式会社,Kyūshū,Fukuoka,福岡県,北九州市,〒805-0047福岡県北九州市八幡東区景勝町1番10号,http://www.sake-tenshin.co.jp/,14,15.642857142857142,14,1.0818177620697813,1.5230769230769232,13,0.1589226549501683,2.0,14,4.640954808922571,33.8538909,130.8155207,"1-10 Keishōmachi, Yahatahigashi Ward, Kitakyushu, Fukuoka 805-0047, Japan",0.0666506678852775,76.0,6.811235309506751,15.0,1.5,3.5,60.0,Junmai Daiginjō-shu,"Mizokami Sake Brewing Co., Ltd."
滋賀酒造株式会社,Kansai,Shiga,滋賀県,甲賀市,〒528-0046滋賀県甲賀市水口町三大寺39番地,https://kibumusume.net/,5,16.875,4,2.0564937798755114,,0,,,0,,34.9494461,136.148893,"39 Minakuchichō Sandaiji, Koka, Shiga 528-0046, Japan",0.4275472716318231,164.0,43.43385895445943,16.5,,,,Daiginjō-shu,"Shiga Sake Brewery Co., Ltd."
潜龍酒造株式会社,Kyūshū,Nagasaki,長崎県,佐世保市,〒859-6101長崎県佐世保市江迎町長坂209番地,http://www.sake-honjin.com,26,15.98076923076923,26,1.8519220784405008,1.55,9,0.229128784747792,1.4423076923076923,13,2.4919742971057905,33.3100811,129.6269658,"209 Emukaechō Nagasaka, Sasebo, Nagasaki 859-6101, Japan",0.0425764852503586,1.0,4.36245059441746,15.0,1.5,2.0,65.0,Junmai Daiginjō-shu,"Senryu Sake Brewery Co., Ltd."
澤佐酒造合名会社,Kansai,Mie,三重県,名張市,〒518-0441三重県名張市夏見944,http://webfasrv1.xsrv.jp/,22,15.454545454545457,22,1.9451349011186303,1.568181818181818,22,0.5850407911186426,-0.5909090909090909,22,9.271867798212638,34.6171162,136.1043656,"944 Natsumi, Nabari, Mie 518-0441, Japan",0.4200402163488823,199.0,42.74133066924333,15.0,1.4,1.5,60.0,Junmai Daiginjō-shu,Sawasa Sake Brewery LLC
澤田酒造株式会社,Chūbu,Aichi,愛知県,常滑市,〒479-0818愛知県常滑市古場町4-10,http://hakurou.com/,49,16.20408163265306,49,1.482250426389081,1.715,20,0.3281126250799291,2.789473684210526,38,3.2144765009196195,34.8590792,136.8592746,"4-chōme-10 Kobachō, Tokoname, Aichi 479-0818, Japan",0.0039506346134153,2.0,0.4018123385555799,16.0,1.65,3.0,60.0,Junmai Daiginjō-shu,"Sawada Sake Brewery Co., Ltd."
濱岡酒造株式会社,Chūgoku,Hiroshima,広島県,尾道市,〒722-2102広島県尾道市因島重井町5800-67,http://www.innoshima-shop.jp/,2,15.5,2,0.0,,0,,4.0,1,,34.327653,133.1382641,"5800-67 Innoshimashigeichō, Onomichi, Hiroshima 722-2102, Japan",0.0009459704316782,4.0,0.0964624756046709,15.5,,4.0,47.5,Daiginjō-shu,"Hamaoka Sake Brewery Co., Ltd."
濵田酒造株式会社,Kyūshū,Kagoshima,鹿児島県,いちき串木野市,〒899-2101鹿児島県いちき串木野市湊町4丁目1番地,http://www.hamadasyuzou.co.jp,2,15.0,2,0.0,1.7000000000000002,2,0.1414213562373095,0.5,2,0.7071067811865476,31.691715,130.293565,"4-chōme-1 Minatomachi, Ichikikushikino, Kagoshima 899-2101, Japan",0.0099731746723903,4.0,1.029594496863771,15.0,1.7000000000000002,0.5,65.0,Junmai Ginjō-shu,"Hamada Sake Brewing Co., Ltd."
瀧自慢酒造株式会社,Kansai,Mie,三重県,名張市,〒518-0464三重県名張市赤目町柏原141,http://www.takijiman.jp/,23,15.416666666666666,12,0.9003366373785202,1.4,11,0.1949358868961792,6.227272727272728,11,3.1572427556622595,34.5963505,136.0771135,"Kashiwara-141 Akamechō, Nabari, Mie 518-0464, Japan",0.450426051004437,206.0,45.83548491845139,16.0,1.3,6.0,50.0,Junmai Daiginjō-shu,"Takijiman Sake Brewery Co., Ltd."
瀬古酒造株式会社,Kansai,Shiga,滋賀県,甲賀市,〒520-3421滋賀県甲賀市甲賀町上野1807,http://www.sekoshuzo.co.jp/,14,16.357142857142858,14,0.9492622930986464,1.9,14,0.2320477404461287,3.642857142857143,14,2.3405174594567715,34.8870577,136.2312089,"1807 Kōkachō Ueno, Koka, Shiga 520-3421, Japan",0.3270801506871469,208.0,33.24356691875209,16.5,1.85,3.0,70.0,Junmai Ginjō-shu,"Seko Sake Brewery Co., Ltd."
瀬頭酒造株式会社,Kyūshū,Saga,佐賀県,嬉野市,〒849-1425佐賀県嬉野市塩田町大字五町田甲3117番地,www.azumacho.co.jp/,23,16.0,23,1.0871146130092184,1.408695652173913,23,0.7121753126087199,-6.173913043478261,23,4.086031347641994,33.1242989,130.0638708,"Kō-3117 Shiotachō Ōaza Gochōda, Ureshino, Saga 849-1425, Japan",0.0637827542111042,7.0,6.540764042791009,16.0,1.5,-7.0,68.0,Junmai Daiginjō-shu,"Seto Sake Brewery Co., Ltd."
灘菊酒造株式会社,Kansai,Hyōgo,兵庫県,姫路市,〒670-0972兵庫県姫路市手柄1-121,http://www.nadagiku.co.jp/,22,15.857142857142858,14,1.3506205330054124,,0,,1.0,12,5.0990195135927845,34.8165286,134.6808474,"1-chōme-121 Tegara, Himeji, Hyogo 670-0972, Japan",0.0413749859560092,9.0,4.208782933322055,15.0,,1.0,65.0,Junmai Daiginjō-shu,"Nadagiku Sake Brewery Co., Ltd."
無法松酒造有限会社,Kyūshū,Fukuoka,福岡県,北九州市,〒803-0186福岡県北九州市小倉南区大字新道寺310,http://muhomatsu.ntf.ne.jp/,8,15.0,4,0.0,,0,,,0,,33.7819941,130.863125,"310 Shindōji, Kokuraminami Ward, Kitakyushu, Fukuoka 803-0186, Japan",0.1043324500435434,49.0,10.665035661911896,15.0,,,,Junmai Daiginjō-shu,"Muhomatsu Sake Brewery Co., Ltd."
熊本県酒造研究所,Kyūshū,Kumamoto,熊本県,熊本市,〒860-0073熊本県熊本市島崎1-7-20,,7,15.571428571428571,7,0.7319250547114001,1.4666666666666668,6,0.1211060141638996,0.4285714285714285,7,2.008908730060748,32.8078488,130.6945445,"1-chōme-7-20 Shimasaki, Chuo Ward, Kumamoto, 860-0073, Japan",0.0857319206738548,13.0,8.804305102941912,15.5,1.45,0.5,55.0,Daiginjō-shu,Kumamoto Prefecture Sake Brewing Research Institute
熊野酒造有限会社,Kansai,Kyoto,京都府,京丹後市,〒629-3401京都府京丹後市久美浜町45-1,http://www.kuminoura.com/,15,16.82,15,1.7925241580360525,1.5333333333333334,15,0.3199702367110922,1.8666666666666667,15,2.0998866182543785,35.60494389999999,134.9018432,"45-1 Kumihamachō, Kyōtango, Kyoto 629-3410, Japan",0.0416648694394116,1.0,4.221819630892118,15.8,1.6,2.0,60.0,Junmai Daiginjō-shu,"Kumano Sake Brewery Co., Ltd."
片山酒造株式会社,Kantō,Tochigi,栃木県,日光市,〒321-1263栃木県日光市瀬川146-2,http://www.kashiwazakari.com/,15,17.416666666666668,12,1.5642792899510296,1.62,5,0.1923538406167133,1.5,8,1.927248223318863,36.7278948,139.6867903,"146-2 Segawa, Nikko, Tochigi 321-1263, Japan",0.9626569285590432,395.0,96.83212484148515,17.0,1.7,2.0,55.0,Junmai Daiginjō-shu,"Katayama Sake Brewing Co., Ltd."
片岡酒造,Kyūshū,Fukuoka,福岡県,朝倉郡,〒838-1701福岡県朝倉郡東峰村宝珠山22,https://www.kataokasyuzou.com/,2,,0,,,0,,,0,,33.3957143,130.8730253,"22 Hōshuyama, Toho, Asakura District, Fukuoka 838-1701, Japan",0.317204138227198,147.0,32.47312009504976,,,,,Junmai Ginjō-shu,Kataoka Sake Brewery
牧野酒造合資会社,Chūbu,Shizuoka,静岡県,富士宮市,〒418-0114静岡県富士宮市下条1037,http://www.makino-shuzo.com/,15,15.533333333333331,15,1.7265434778633235,,0,,3.6,15,4.532422877761644,35.2685792,138.5717715,"1037 Shimojō, Fujinomiya, Shizuoka 418-0114, Japan",0.1549481713407314,282.0,15.723680709303874,15.0,,4.0,70.0,Junmai Daiginjō-shu,Makino Sake Brewery Limited Partnership Company
牧野酒造株式会社,Kantō,Gunma,群馬県,高崎市,〒370-3401群馬県高崎市倉渕町権田2625-1,http://www.makino-sake.co.jp/,21,16.25,16,1.0589302778433218,2.00625,16,2.6684499245816853,2.53125,16,1.839100776647834,36.4538048,138.773501,"2625-1 Kurabuchimachi Gonda, Takasaki, Gunma 370-3401, Japan",0.8972702360956285,539.0,90.39233987355124,15.8,1.35,3.0,60.0,Junmai Daiginjō-shu,"Makino Sake Brewery Co., Ltd."
狩場一酒造株式会社,Kansai,Hyōgo,兵庫県,丹波篠山市,〒669-2103兵庫県丹波篠山市波賀野500,http://syuugetu.jp/,12,16.25,12,1.0552897060221724,,0,,2.583333333333333,12,2.108783937953269,35.025643,135.1648573,"500 Hagano, Tanbasasayama-shi, Hyogo 669-2103, Japan",0.3369828554222295,198.0,34.22613697531946,16.5,,2.0,60.0,Junmai Daiginjō-shu,"Karibaichi Sake Brewery Co., Ltd."
玄葉本店,Tōhoku,Fukushima,福島県,田村市,〒963-4312福島県田村市船引町船引北町通41,http://www.sakezanmai.net/sake/genba.html,4,,0,,,0,,,0,,37.4386194,140.5757696,"Kitamachitōri-41 Funehikimachi Funehiki, Tamura, Fukushima 963-4312, Japan",0.46238020555359,409.0,46.38248459657919,,,,,Daiginjō-shu,Genba main store
玉乃光酒造株式会社,Kansai,Kyoto,京都府,京都市,〒612-8066京都府京都市伏見区東堺町545-2,http://www.tamanohikari.co.jp/,21,15.714285714285714,21,0.9023778112773576,,0,,,0,,34.9376376,135.7581145,"545-2 Higashisakaimachi, Fushimi Ward, Kyoto, 612-8066, Japan",0.4236109860372711,16.0,43.0367725904598,16.0,,,60.0,Junmai Daiginjō-shu,"Tamanohikari Sake Brewery Co., Ltd."
玉櫻酒造有限会社,Chūgoku,Shimane,島根県,邑智郡,〒696-0404島根県邑智郡邑南町原村148,http://www.tamazakura.com/,6,,0,,,0,,,0,,34.8711274,132.5586648,"148 Haramura, Onan, Ochi District, Shimane 696-0404, Japan",0.3082841001714098,282.0,31.33665931071109,,,,70.0,Junmai-shu,"Tamazakura Sake Brewery Co., Ltd."
玉泉堂酒造株式会社,Chūbu,Gifu,岐阜県,養老郡,〒503-1314岐阜県養老郡養老町高田800-3,https://www.minogiku.co.jp/,24,15.566666666666668,24,0.7440585920515915,1.3625,24,0.1209113940759567,3.595238095238096,21,2.586595482574767,35.3086848,136.5603178,"800-3 Takada, Yoro, Yoro District, Gifu 503-1314, Japan",0.3263793650517941,10.0,33.10348722954902,15.475,1.3,3.0,50.0,Junmai Daiginjō-shu,"Gyokusendo Sake Brewery Co., Ltd."
王祿酒造有限会社,Chūgoku,Shimane,島根県,松江市,〒699-0101島根県松江市東出雲町揖屋484番地,http://www.ouroku.com/,29,15.3,2,0.0,,0,,,0,,35.4279646,133.14277,"484 Higashiizumochō Iya, Matsue, Shimane 699-0101, Japan",0.1353518619860357,3.0,13.724741689836264,15.3,,,55.0,Junmai Daiginjō-shu,"Wangyi Sake Brewery Co., Ltd."
珂北酒造有限会社,Kantō,Ibaraki,茨城県,久慈郡,〒319-3515茨城県久慈郡大子町内大野1887,https://kahoku1896.jimdo.com/,4,,0,,,0,,,0,,36.7879473,140.4209523,"1887 Uchiōno, Daigo, Kuji District, Ibaraki 319-3515, Japan",0.3116569088192796,270.0,31.37658526232125,,,,50.0,Daiginjō-shu,"Kahoku Sake Brewery Co., Ltd."
瑞穂菊酒造株式会社,Kyūshū,Fukuoka,福岡県,飯塚市,〒820-0075福岡県飯塚市天道375,http://www.mizuhogiku.com/,20,15.733333333333333,15,1.222799286570816,,0,,,0,,33.6038415,130.6760113,"375 Tentō, Iizuka, Fukuoka 820-0075, Japan",0.2508520701138489,25.0,25.65795552965527,15.0,,,60.0,Junmai Daiginjō-shu,"Mizuhogiku Sake Brewery Co., Ltd."
瑞鷹株式会社,Kyūshū,Kumamoto,熊本県,熊本市,〒861-4115熊本市南区川尻四丁目6番67号,http://www.zuiyo.co.jp,38,15.228571428571428,35,1.139806853754418,1.211764705882353,17,0.1866894243830394,4.647058823529412,17,2.8491484796029023,32.7374437,130.6822418,"4-chōme-6-67 Kawashiri, Minami Ward, Kumamoto, 861-4115, Japan",0.0619858047962503,6.0,6.3680160763957305,15.0,1.2,6.0,65.0,Junmai Daiginjō-shu,"Mizutaka Co., Ltd."
甘強酒造株式会社,Chūbu,Aichi,愛知県,海部郡,〒497-0040愛知県海部郡蟹江町城四丁目1番地,https://www.kankyo-shuzo.co.jp/,5,16.1,5,0.894427190999916,1.3,5,0.1,2.9,5,2.924038303442689,35.1313569,136.7898979,"4-chōme-1 Shiro, Kanie, Ama District, Aichi 497-0040, Japan",0.066155944397437,-1.0,6.718897070598841,15.5,1.3,4.0,60.0,Daiginjō-shu,"Amagyo Sake Brewery Co., Ltd."
生熊酒造株式会社,Chūgoku,Hiroshima,広島県,庄原市,〒729-5125広島県庄原市東城町川西887番地1,http://ikumashuzo.com/,4,16.166666666666668,3,1.1547005383792517,,0,,5.5,3,3.278719262151,34.903008,133.2642391,"Tojocho Kawanishi, Shobara, Hiroshima 729-5125, Japan",0.461006603775698,387.0,46.84089992634546,15.5,,6.0,50.0,Daiginjō-shu,"Ikuma Sake Brewery Co., Ltd."
田中酒造株式会社,Hokkaidō,Hokkaido,北海道,小樽市,〒047-0031北海道小樽市色内3-2-5,http://www.tanakashuzo.com/,13,15.5,13,1.4719601443879744,,0,,3.807692307692308,13,4.973004044917844,43.2034507,140.9985427,"3-chōme-2-5 Ironai, Otaru, Hokkaido 047-0031, Japan",0.009595391333531,5.0,0.9335969240179366,15.0,,2.0,60.0,Junmai Daiginjō-shu,"Tanaka Sake Brewery Co., Ltd."
田治米合名会社,Kansai,Hyōgo,兵庫県,朝来市,〒669-5103兵庫県朝来市山東町矢名瀬町545,http://www.chikusen-1702.com/,27,14.0,1,,,0,,,0,,35.3176774,134.8851275,"545 Santōchō Yanasemachi, Asago, Hyogo 669-5103, Japan",0.3262035620927072,94.0,33.08419231712002,14.0,,,40.0,Junmai Daiginjō-shu,Tajimae LLC
田端酒造株式会社,Kansai,Wakayama,和歌山県,和歌山市,〒640-8324和歌山県和歌山市吹屋町5丁目13-1,https://www.rashomon-kuramoto.co.jp/,9,15.77777777777778,9,0.6666666666666659,1.3888888888888888,9,0.1364225461978742,2.5,9,1.3228756555322951,34.2263118,135.1913697,"5-chōme-13-1 Fukiyachō, Wakayama, 640-8324, Japan",0.0470979476898634,3.0,4.804642531477006,15.5,1.4,2.5,59.0,Junmai Daiginjō-shu,"Tabata Sake Brewery Co., Ltd."
男山本店,Tōhoku,Miyagi,宮城県,気仙沼市,〒988-0083宮城県気仙沼市入沢3-8,http://www.kesennuma.co.jp/,11,15.954545454545457,11,0.8501336793277117,,0,,0.8181818181818182,11,2.272363607268072,38.9080004,141.5737582,"3-8 Irisawa, Kesennuma, Miyagi 988-0083, Japan",0.0297158981515131,8.0,2.960351283940188,16.0,,0.0,60.0,Junmai Daiginjō-shu,Otokoyama Main Store
男山株式会社,Hokkaidō,Hokkaido,北海道,旭川市,〒079-8412北海道旭川市永山2条7丁目1番33号,http://www.otokoyama.com/,38,14.657894736842104,38,1.046908338729461,,0,,,0,,43.7958667,142.4091271,"7-chōme-1-33 Nagayama 2 Jō, Asahikawa, Hokkaido 079-8412, Japan",0.7733609368310244,124.0,74.87449825221138,15.0,,,60.0,Junmai Daiginjō-shu,"Otokoyama Co., Ltd."
男山酒造株式会社,Tōhoku,Yamagata,山形県,山形市,〒990-0037山形県山形市八日町2-4-13,http://www.otokoyama.co.jp/,21,15.488888888888887,9,1.4666666666666668,1.1777777777777778,9,0.1201850425154662,3.0,9,1.0,38.2419766,140.3310865,"2-chōme-4-13 Yōkamachi, Yamagata, 990-0037, Japan",0.6251131368180377,138.0,62.42500110100076,15.2,1.2,3.0,55.0,Junmai Daiginjō-shu,"Otokoyama Sake Brewery Co., Ltd."
男自慢酒造株式会社,Chūgoku,Yamaguchi,山口県,周南市,〒746-0062山口県周南市福川中市町8-33,http://otokojiman.mods.jp/,7,16.0,5,1.224744871391589,,0,,4.6,5,0.5477225575051662,34.073963,131.7344778,"8-33 Fukugawanakaichichō, Shunan, Yamaguchi 746-0062, Japan",0.0190244253403422,4.0,1.9422713107807383,16.0,,5.0,60.0,Junmai Daiginjō-shu,"Otokojiman Sake Brewery Co., Ltd."
白扇酒造株式会社,Chūbu,Gifu,岐阜県,加茂郡,〒509-0304岐阜県加茂郡川辺町中川辺28番地,https://www.hakusenshuzou.jp/,13,16.0,12,0.5222329678670934,1.7,4,0.2581988897471611,-1.9166666666666667,12,3.117642854737689,35.4877036,137.0683765,"28 Nakakawabe, Kawabe, Kamo District, Gifu 509-0304, Japan",0.4383702755790203,103.0,44.41405252470472,16.0,1.7000000000000002,-3.0,60.0,Junmai Daiginjō-shu,"Hakusen Sake Brewery Co., Ltd."
白杉酒造株式会社,Kansai,Kyoto,京都府,京丹後市,〒629-2503京都府京丹後市大宮町周枳954,https://shirakiku.shopinfo.jp/,8,15.6,7,1.0645812948447535,2.42,5,0.8843076387773657,-5.8,5,9.011104260855047,35.5905497,135.1027326,"954 Ōmiyachō Suki, Kyōtango, Kyoto 629-2503, Japan",0.0891682602572536,55.0,9.03513686701211,15.5,2.0,-5.0,60.0,Junmai Daiginjō-shu,"Shirasugi Sake Brewery Co., Ltd."
白河銘醸株式会社,Tōhoku,Fukushima,福島県,西白河郡,〒961-8061福島県西白河郡西郷村小田倉中庄司4-2,http://www.shirakawa-meijo.com/,8,15.88125,8,1.7221119716374844,1.3125,8,0.264237447329913,1.3125,8,1.1319231422671772,37.1293432,140.1730386,"Nakashōji-4-2 Odakura, Nishigō, Nishishirakawa District, Fukushima 961-8061, Japan",0.6733512982386023,392.0,67.6274164233816,15.45,1.3,1.75,60.0,Junmai Ginjō-shu,"Shirakawa Meijo Co., Ltd."
白牡丹酒造株式会社,Chūgoku,Hiroshima,広島県,東広島市,〒739-0011広島県東広島市西条本町15番5号,http://www.hakubotan.co.jp/,28,15.178571428571429,28,2.211980366743146,1.3392857142857142,28,0.2078804601550749,-4.482142857142857,28,13.97450200719891,34.429462,132.7452111,"Japan, 〒739-0011 Hiroshima, Higashihiroshima, Saijōhonmachi, 15−５ 15番5号",0.1456957524355838,219.0,14.845882663758587,15.0,1.35,-2.0,62.5,Daiginjō-shu,"Hakubotan Sake Brewery Co., Ltd."
白神酒造株式会社,Tōhoku,Aomori,青森県,弘前市,〒036-1443青森県弘前市米ケ袋字村元22,http://www.sirakami-sake.jp/,3,,0,,,0,,,0,,40.5854598,140.3251346,"Muramoto-22 Yonegafukuro, Hirosaki, Aomori 036-1443, Japan",0.215352815719811,98.0,21.25298602105038,,,,,Daiginjō-shu,"Shirakami Sake Brewery Co., Ltd."
白糸酒造株式会社,Kansai,Kyoto,京都府,宮津市,〒629-2244京都府宮津市江尻382,http://sake-shiraito.com/,33,15.735294117647058,17,0.7313866765181295,,0,,,0,,35.5796682,135.1994691,"382 Ejiri, Miyazu, Kyoto 629-2244, Japan",0.0002630012059944,3.0,0.0266546878107022,15.5,,,65.0,Junmai Ginjō-shu,"Shiraito Sake Brewery Co., Ltd."
白菊酒造株式会社,Chūgoku,Okayama,岡山県,高梁市,〒716-0101岡山県高梁市成羽町下日名163-1,http://www.shiragiku.com/,24,16.163157894736845,19,1.3756657080667805,1.4973684210526317,19,0.3220911207383394,4.447368421052632,19,2.159570024347087,34.771976,133.5486113,"163-1 Nariwachō Shimohina, Takahashi, Okayama 716-0101, Japan",0.2837991911662603,78.0,28.86304553937376,16.45,1.5,4.0,65.0,Junmai Daiginjō-shu,"Shiragiku Sake Brewery Co., Ltd."
白蘭酒造株式会社,Chūgoku,Hiroshima,広島県,三次市,〒728-0021広島県三次市三次町1550-2,http://www.pionet.ne.jp/~hakuran/,17,15.852941176470589,17,1.1147408034263069,1.5,6,0.1673320053068151,3.5,6,1.224744871391589,34.81263020000001,132.8473952,"1550-2 Miyoshimachi, Miyoshi, Hiroshima 728-0021, Japan",0.4887412222292842,157.0,49.67853665483487,15.5,1.55,4.0,70.0,Daiginjō-shu,"Byakuran Sake Brewery Co., Ltd."
白鶴酒造株式会社,Kansai,Hyōgo,兵庫県,神戸市,〒658-0041兵庫県神戸市東灘区住吉南町4丁目5-5,http://www.hakutsuru.co.jp/,42,14.464285714285714,42,2.0730349412385265,1.3666666666666667,42,0.3213285429592665,1.1904761904761905,42,11.733292418891816,34.7103539,135.2605197,"4-chōme-5-5 Sumiyoshi Minamimachi, Higashinada Ward, Kobe, Hyogo 658-0041, Japan",0.0109944157960332,8.0,1.119022271388459,15.5,1.3,3.0,50.0,Junmai Daiginjō-shu,"Hakutsuru Sake Brewery Co., Ltd."
白鷹株式会社,Kansai,Hyōgo,兵庫県,西宮市,〒662-0942兵庫県西宮市浜町1番1号,https://hakutaka.jp/,22,16.297727272727272,22,0.7431396191204547,,0,,2.959090909090909,22,1.2362227765442415,34.7310281,135.3375697,"1-1 Hamachō, Nishinomiya, Hyogo 662-0942, Japan",0.0227114118679572,6.0,2.31130969157803,16.45,,3.0,70.0,Junmai Daiginjō-shu,"Shirataka Co., Ltd."
盛川酒造株式会社,Chūgoku,Hiroshima,広島県,呉市,〒737-2506広島県呉市安浦町原畑44,http://morikawa-shuzo.com/,22,16.431818181818183,22,1.0943083763322037,1.4727272727272729,22,0.2313147066368533,3.3181818181818183,22,4.65358401190353,34.2801265,132.7253326,"44 Yasuurachō Ōaza Harahata, Kure, Hiroshima 737-2506, Japan",0.0381635415160836,32.0,3.892257880370031,16.25,1.45,5.0,60.0,Junmai Daiginjō-shu,"Morikawa Sake Brewery Co., Ltd."
盛田株式会社,Chūbu,Aichi,愛知県,名古屋市,〒460-0008愛知県名古屋市中区栄1丁目7番34号,http://moritakk.com/,23,15.195652173913045,23,1.362977442909978,1.4,7,0.3214550253664318,0.8571428571428571,7,4.845223470201399,35.1672079,136.8953048,"1-chōme-7-34 Sakae, Naka Ward, Nagoya, Aichi 460-0008, Japan",0.077449740499008,24.0,7.864367956578723,15.5,1.4,2.0,68.0,Junmai Daiginjō-shu,"Morita Co., Ltd."
盛田金しゃち酒造株式会社,Chūbu,Aichi,愛知県,半田市,〒475-0023愛知県半田市亀崎町九丁目112,https://www.kinshachi.co.jp/,16,15.8125,16,0.9464847243000458,1.3875,16,0.1310216267135569,2.53125,16,0.8844725358464595,34.9116798,136.9631962,"9-chōme-112 Kamezakichō, Handa, Aichi 475-0023, Japan",0.0057207513950883,1.0,0.5816963360425546,15.5,1.35,3.0,65.0,Junmai Daiginjō-shu,"Morita Kinshachi Sake Brewery Co., Ltd."
相原酒造株式会社,Chūgoku,Hiroshima,広島県,呉市,〒737-0152広島県呉市仁方本町1丁目25番15号,https://www.ugonotsuki.com/,20,16.13157894736842,19,1.7546929555968052,1.6473684210526316,19,0.9453796539266538,0.6578947368421053,19,6.896159622852391,34.2267663,132.6514836,"1-chōme-25-15 Nigatahonmachi, Kure, Hiroshima 737-0152, Japan",0.0263037362116424,6.0,2.68343443933748,16.0,1.5,2.5,50.0,Junmai Daiginjō-shu,"Aihara Sake Brewery Co., Ltd."
相生ユニビオ株式会社,Chūbu,Aichi,愛知県,西尾市,〒445-0891愛知県西尾市下町丸山5番地,http://www.unibio.jp/,13,14.73076923076923,13,1.2009611535381526,,0,,2.0,5,2.549509756796392,34.8742107,137.0387669,"Maruyama-5 Shimomachi, Nishio, Aichi 445-0891, Japan",0.0611037006352346,5.0,6.213678772276341,15.0,,3.0,53.0,Junmai Daiginjō-shu,"Aioi Unibio Co., Ltd."
矢尾酒造株式会社,Kansai,Shiga,滋賀県,蒲生郡,〒529-1662滋賀県蒲生郡日野町中在寺512,https://www.suzumasamune.com/,5,15.25,4,0.5000000000000001,2.033333333333333,3,0.1154700538379252,2.833333333333333,3,1.607275126832159,35.0513844,136.237341,"512 Nakazaiji, Hino, Gamo District, Shiga 529-1662, Japan",0.4120783157553263,157.0,41.84251577206445,15.0,2.1,3.5,55.0,Junmai Ginjō-shu,"Yao Sake Brewery Co., Ltd."
矢野酒造株式会社,Kyūshū,Saga,佐賀県,鹿島市,〒849-1311佐賀県鹿島市高津原3903-1,http://yanoshuzou.jp/,8,15.0,2,0.0,,0,,2.5,2,2.1213203435596424,33.1130006,130.0937325,"3903-1 Takatsuhara, Kashima, Saga 849-1311, Japan",0.0347504834533513,-2.0,3.563937258138456,15.0,,2.5,58.5,Junmai Daiginjō-shu,"Yano Sake Brewery Co., Ltd."
石岡酒造株式会社,Kantō,Ibaraki,茨城県,石岡市,〒315-0031茨城県石岡市東大橋2972,http://www.ishiokashuzo.co.jp/,22,15.590909090909092,22,1.0537502599713136,1.318181818181818,22,0.2519190414859573,3.136363636363636,22,1.2834274997778985,36.1929844,140.3055792,"2972 Higashiōhashi, Ishioka, Ibaraki 315-0031, Japan",0.2656770815112877,22.0,26.830660731294905,15.0,1.25,3.0,50.0,Junmai Daiginjō-shu,"Ishioka Sake Brewery Co., Ltd."
石川酒造株式会社,Kansai,Mie,三重県,四日市市,〒512-1211三重県四日市市桜町129,http://e-sakagura.co.jp/,12,,0,,,0,,,0,,34.9944757,136.5395966,"129 Sakurachō, Yokkaichi, Mie 512-1211, Japan",0.1118650853048592,38.0,11.367932380177422,,,,,Junmai Daiginjō-shu,"Ishikawa Sake Brewery Co., Ltd."
石蔵酒造株式会社,Kyūshū,Fukuoka,福岡県,福岡市,〒812-0043福岡市博多区堅粕一丁目30番1号,https://www.ishikura-shuzou.co.jp/,8,7.0,1,,,0,,,0,,33.5988719,130.4176133,"1-chōme-30-1 Katakasu, Hakata Ward, Fukuoka, 812-0043, Japan",0.0248802357982822,9.0,2.545858717382818,7.0,,,55.0,Junmai Daiginjō-shu,"Ishikura Sake Brewery Co., Ltd."
石越醸造株式会社,Tōhoku,Miyagi,宮城県,登米市,〒989-4701宮城県登米市石越町北郷中澤108-1,http://sawanoizumi.jp/,17,15.941176470588236,17,1.6286723210676126,,0,,,0,,38.7585116,141.1832049,"Nakazawa-108-1 Ishikoshimachi Kitagō, Tome, Miyagi 989-4701, Japan",0.2962413893204743,26.0,29.520742917408835,15.5,,,50.0,Junmai Daiginjō-shu,"Ishikoshi Brewing Co., Ltd."
